{
  "schema_version": "0.1",
  "name": "SK Hynix 000660 HBM Supply Constraint Thesis",
  "canonical_url": "https://barneywohl.github.io/korea-research-map-agents/agentpress/examples/sk-hynix-hbm-supply/",
  "entrypoint": "https://barneywohl.github.io/korea-research-map-agents/agentpress/examples/sk-hynix-hbm-supply/AGENT_ENTRYPOINT.md",
  "llms_txt": "https://barneywohl.github.io/korea-research-map-agents/agentpress/examples/sk-hynix-hbm-supply/llms.txt",
  "task_card": "https://barneywohl.github.io/korea-research-map-agents/agentpress/examples/sk-hynix-hbm-supply/agent-task-card.json",
  "source_map": "https://barneywohl.github.io/korea-research-map-agents/agentpress/examples/sk-hynix-hbm-supply/source-map.json",
  "allowed_actions": "https://barneywohl.github.io/korea-research-map-agents/agentpress/examples/sk-hynix-hbm-supply/allowed-actions.json",
  "citation_policy": "https://barneywohl.github.io/korea-research-map-agents/agentpress/examples/sk-hynix-hbm-supply/citation-policy.md",
  "disclaimer": "Research commentary only. Not investment advice."
}
