{
  "schema_version": "0.1",
  "name": "Korea Liquidity Trap Agent Benchmark",
  "canonical_url": "https://barneywohl.github.io/korea-research-map-agents/agentpress/examples/liquidity-trap/",
  "entrypoint": "https://barneywohl.github.io/korea-research-map-agents/agentpress/examples/liquidity-trap/AGENT_ENTRYPOINT.md",
  "llms_txt": "https://barneywohl.github.io/korea-research-map-agents/agentpress/examples/liquidity-trap/llms.txt",
  "task_card": "https://barneywohl.github.io/korea-research-map-agents/agentpress/examples/liquidity-trap/agent-task-card.json",
  "source_map": "https://barneywohl.github.io/korea-research-map-agents/agentpress/examples/liquidity-trap/source-map.json",
  "allowed_actions": "https://barneywohl.github.io/korea-research-map-agents/agentpress/examples/liquidity-trap/allowed-actions.json",
  "citation_policy": "https://barneywohl.github.io/korea-research-map-agents/agentpress/examples/liquidity-trap/citation-policy.md",
  "disclaimer": "Research commentary only. Not investment advice."
}
