{
  "schema_version": "0.1",
  "name": "POSCO 005490 Green Steel Premium Thesis",
  "canonical_url": "https://barneywohl.github.io/korea-research-map-agents/agentpress/examples/posco-green-steel/",
  "entrypoint": "https://barneywohl.github.io/korea-research-map-agents/agentpress/examples/posco-green-steel/AGENT_ENTRYPOINT.md",
  "llms_txt": "https://barneywohl.github.io/korea-research-map-agents/agentpress/examples/posco-green-steel/llms.txt",
  "task_card": "https://barneywohl.github.io/korea-research-map-agents/agentpress/examples/posco-green-steel/agent-task-card.json",
  "source_map": "https://barneywohl.github.io/korea-research-map-agents/agentpress/examples/posco-green-steel/source-map.json",
  "allowed_actions": "https://barneywohl.github.io/korea-research-map-agents/agentpress/examples/posco-green-steel/allowed-actions.json",
  "citation_policy": "https://barneywohl.github.io/korea-research-map-agents/agentpress/examples/posco-green-steel/citation-policy.md",
  "disclaimer": "Research commentary only. Not investment advice."
}
