{
  "schema_version": "0.1",
  "name": "KB-FINRATE Korean Bank NIM Compression Thesis",
  "canonical_url": "https://barneywohl.github.io/korea-research-map-agents/agentpress/examples/kb-finrate/",
  "entrypoint": "https://barneywohl.github.io/korea-research-map-agents/agentpress/examples/kb-finrate/AGENT_ENTRYPOINT.md",
  "llms_txt": "https://barneywohl.github.io/korea-research-map-agents/agentpress/examples/kb-finrate/llms.txt",
  "task_card": "https://barneywohl.github.io/korea-research-map-agents/agentpress/examples/kb-finrate/agent-task-card.json",
  "source_map": "https://barneywohl.github.io/korea-research-map-agents/agentpress/examples/kb-finrate/source-map.json",
  "allowed_actions": "https://barneywohl.github.io/korea-research-map-agents/agentpress/examples/kb-finrate/allowed-actions.json",
  "citation_policy": "https://barneywohl.github.io/korea-research-map-agents/agentpress/examples/kb-finrate/citation-policy.md",
  "disclaimer": "Research commentary only. Not investment advice."
}
