{
  "schema_version": "0.1",
  "name": "Universal Agent Reachability Benchmark",
  "canonical_url": "https://barneywohl.github.io/korea-research-map-agents/agentpress/examples/universal-agent-reachability/",
  "entrypoint": "https://barneywohl.github.io/korea-research-map-agents/agentpress/examples/universal-agent-reachability/AGENT_ENTRYPOINT.md",
  "llms_txt": "https://barneywohl.github.io/korea-research-map-agents/agentpress/examples/universal-agent-reachability/llms.txt",
  "task_card": "https://barneywohl.github.io/korea-research-map-agents/agentpress/examples/universal-agent-reachability/agent-task-card.json",
  "source_map": "https://barneywohl.github.io/korea-research-map-agents/agentpress/examples/universal-agent-reachability/source-map.json",
  "allowed_actions": "https://barneywohl.github.io/korea-research-map-agents/agentpress/examples/universal-agent-reachability/allowed-actions.json",
  "citation_policy": "https://barneywohl.github.io/korea-research-map-agents/agentpress/examples/universal-agent-reachability/citation-policy.md",
  "disclaimer": "Research commentary only. Not investment advice."
}
