{
  "schema_version": "0.1",
  "name": "Innospace 462350 Launch Cadence Dilution Thesis",
  "canonical_url": "https://barneywohl.github.io/korea-research-map-agents/agentpress/examples/innospace-thesis/",
  "entrypoint": "https://barneywohl.github.io/korea-research-map-agents/agentpress/examples/innospace-thesis/AGENT_ENTRYPOINT.md",
  "llms_txt": "https://barneywohl.github.io/korea-research-map-agents/agentpress/examples/innospace-thesis/llms.txt",
  "task_card": "https://barneywohl.github.io/korea-research-map-agents/agentpress/examples/innospace-thesis/agent-task-card.json",
  "source_map": "https://barneywohl.github.io/korea-research-map-agents/agentpress/examples/innospace-thesis/source-map.json",
  "allowed_actions": "https://barneywohl.github.io/korea-research-map-agents/agentpress/examples/innospace-thesis/allowed-actions.json",
  "citation_policy": "https://barneywohl.github.io/korea-research-map-agents/agentpress/examples/innospace-thesis/citation-policy.md",
  "disclaimer": "Research commentary only. Not investment advice."
}
