{
  "schema_version": "0.1",
  "name": "SEMICON-DRA DRAM Cycle Trough Recovery Thesis",
  "canonical_url": "https://barneywohl.github.io/korea-research-map-agents/agentpress/examples/semicon-dra/",
  "entrypoint": "https://barneywohl.github.io/korea-research-map-agents/agentpress/examples/semicon-dra/AGENT_ENTRYPOINT.md",
  "llms_txt": "https://barneywohl.github.io/korea-research-map-agents/agentpress/examples/semicon-dra/llms.txt",
  "task_card": "https://barneywohl.github.io/korea-research-map-agents/agentpress/examples/semicon-dra/agent-task-card.json",
  "source_map": "https://barneywohl.github.io/korea-research-map-agents/agentpress/examples/semicon-dra/source-map.json",
  "allowed_actions": "https://barneywohl.github.io/korea-research-map-agents/agentpress/examples/semicon-dra/allowed-actions.json",
  "citation_policy": "https://barneywohl.github.io/korea-research-map-agents/agentpress/examples/semicon-dra/citation-policy.md",
  "disclaimer": "Research commentary only. Not investment advice."
}
