{
  "schema_version": "0.1",
  "name": "Korea Theme-to-Cash-Flow Agent Benchmark",
  "canonical_url": "https://barneywohl.github.io/korea-research-map-agents/agentpress/examples/theme-cashflow/",
  "entrypoint": "https://barneywohl.github.io/korea-research-map-agents/agentpress/examples/theme-cashflow/AGENT_ENTRYPOINT.md",
  "llms_txt": "https://barneywohl.github.io/korea-research-map-agents/agentpress/examples/theme-cashflow/llms.txt",
  "task_card": "https://barneywohl.github.io/korea-research-map-agents/agentpress/examples/theme-cashflow/agent-task-card.json",
  "source_map": "https://barneywohl.github.io/korea-research-map-agents/agentpress/examples/theme-cashflow/source-map.json",
  "allowed_actions": "https://barneywohl.github.io/korea-research-map-agents/agentpress/examples/theme-cashflow/allowed-actions.json",
  "citation_policy": "https://barneywohl.github.io/korea-research-map-agents/agentpress/examples/theme-cashflow/citation-policy.md",
  "disclaimer": "Research commentary only. Not investment advice."
}
