{
  "schema_version": "0.1",
  "name": "Samsung 005930 HBM Margin Inflection Thesis",
  "canonical_url": "https://barneywohl.github.io/korea-research-map-agents/agentpress/examples/samsung-hbm-margin/",
  "entrypoint": "https://barneywohl.github.io/korea-research-map-agents/agentpress/examples/samsung-hbm-margin/AGENT_ENTRYPOINT.md",
  "llms_txt": "https://barneywohl.github.io/korea-research-map-agents/agentpress/examples/samsung-hbm-margin/llms.txt",
  "task_card": "https://barneywohl.github.io/korea-research-map-agents/agentpress/examples/samsung-hbm-margin/agent-task-card.json",
  "source_map": "https://barneywohl.github.io/korea-research-map-agents/agentpress/examples/samsung-hbm-margin/source-map.json",
  "allowed_actions": "https://barneywohl.github.io/korea-research-map-agents/agentpress/examples/samsung-hbm-margin/allowed-actions.json",
  "citation_policy": "https://barneywohl.github.io/korea-research-map-agents/agentpress/examples/samsung-hbm-margin/citation-policy.md",
  "disclaimer": "Research commentary only. Not investment advice."
}
